<?xml version="1.0" encoding="UTF-8" ?>
<!--
 *  Copyright (c) 2001-2005 The Open For Business Project - www.ofbiz.org
 *
 *  Permission is hereby granted, free of charge, to any person obtaining a
 *  copy of this software and associated documentation files (the "Software"),
 *  to deal in the Software without restriction, including without limitation
 *  the rights to use, copy, modify, merge, publish, distribute, sublicense,
 *  and/or sell copies of the Software, and to permit persons to whom the
 *  Software is furnished to do so, subject to the following conditions:
 *
 *  The above copyright notice and this permission notice shall be included
 *  in all copies or substantial portions of the Software.
 *
 *  THE SOFTWARE IS PROVIDED "AS IS", WITHOUT WARRANTY OF ANY KIND, EXPRESS
 *  OR IMPLIED, INCLUDING BUT NOT LIMITED TO THE WARRANTIES OF
 *  MERCHANTABILITY, FITNESS FOR A PARTICULAR PURPOSE AND NONINFRINGEMENT.
 *  IN NO EVENT SHALL THE AUTHORS OR COPYRIGHT HOLDERS BE LIABLE FOR ANY
 *  CLAIM, DAMAGES OR OTHER LIABILITY, WHETHER IN AN ACTION OF CONTRACT, TORT
 *  OR OTHERWISE, ARISING FROM, OUT OF OR IN CONNECTION WITH THE SOFTWARE OR
 *  THE USE OR OTHER DEALINGS IN THE SOFTWARE.
-->

<services xmlns:xsi="http://www.w3.org/2001/XMLSchema-instance" 
        xsi:noNamespaceSchemaLocation="http://www.ofbiz.org/dtds/services.xsd">
    <description>Accounting Services</description>
    <vendor>OFBiz</vendor>
    <version>1.0</version>

    <!-- Invoice services -->
    <service name="createInvoice" engine="simple"
            location="org/ofbiz/accounting/invoice/InvoiceServices.xml" invoke="createInvoice">
        <description>Create Inovice Record</description>
        <attribute name="invoiceTypeId" type="String" mode="IN" optional="false"/>
        <attribute name="partyId" type="String" mode="IN" optional="true"/>
        <attribute name="roleTypeId" type="String" mode="IN" optional="true"/>
        <attribute name="statusId" type="String" mode="IN" optional="false"/>
        <attribute name="billingAccountId" type="String" mode="IN" optional="true"/>
        <attribute name="contactMechId" type="String" mode="IN" optional="true"/>
        <attribute name="invoiceMessage" type="String" mode="IN" optional="true"/>
        <attribute name="description" type="String" mode="IN" optional="true"/>
        <attribute name="invoiceId" type="String" mode="OUT" optional="false"/>
    </service>
    <service name="createInvoiceItem" engine="simple"
            location="org/ofbiz/accounting/invoice/InvoiceServices.xml" invoke="createInvoiceItem">
        <description>Create Invoice Item Record</description>
        <attribute name="invoiceId" type="String" mode="IN" optional="false"/>
        <attribute name="invoiceItemSeqId" type="String" mode="IN" optional="false"/>
        <attribute name="invoiceItemTypeId" type="String" mode="IN" optional="false"/>
        <attribute name="inventoryItemId" type="String" mode="IN" optional="true"/>
        <attribute name="productId" type="String" mode="IN" optional="true"/>
        <attribute name="productFeatureId" type="String" mode="IN" optional="true"/>
        <attribute name="uomId" type="String" mode="IN" optional="true"/>
        <attribute name="taxableFlag" type="Boolean" mode="IN" optional="false"/>
        <attribute name="quantity" type="Double" mode="IN" optional="false"/>
        <attribute name="amount" type="Double" mode="IN" optional="false"/>
        <attribute name="description" type="String" mode="IN" optional="true"/>
    </service>
    <service name="createInvoiceRole" engine="simple"
            location="org/ofbiz/accounting/invoice/InvoiceServices.xml" invoke="createInvoiceRole">
        <description>Create Invoice Role Record</description>
        <attribute name="invoiceId" type="String" mode="IN" optional="false"/>
        <attribute name="partyId" type="String" mode="IN" optional="false"/>
        <attribute name="roleTypeId" type="String" mode="IN" optional="false"/>
        <attribute name="datetimePerformed" type="Timestamp" mode="IN" optional="true"/>
        <attribute name="percentage" type="Double" mode="IN" optional="true"/>
    </service>
    <service name="setInvoiceStatus" engine="simple"
            location="org/ofbiz/accounting/invoice/InvoiceServices.xml" invoke="setInvoiceStatus">
        <description>Create Invoice (Item) Term Record</description>
        <attribute name="statusId" type="String" mode="IN" optional="false"/>
        <attribute name="invoiceId" type="String" mode="IN" optional="false"/>
        <attribute name="statusDate" type="Timestamp" mode="IN" optional="true"/>
    </service>
    <service name="createInvoiceTerm" engine="simple"
            location="org/ofbiz/accounting/invoice/InvoiceServices.xml" invoke="createInvoiceTerm">
        <description>Create Invoice (Item) Term Record</description>
        <attribute name="termTypeId" type="String" mode="IN" optional="false"/>
        <attribute name="invoiceId" type="String" mode="IN" optional="false"/>
        <attribute name="invoiceItemSeqId" type="String" mode="IN" optional="false"/>
        <attribute name="termValue" type="Long" mode="IN" optional="false"/>
        <attribute name="uomId" type="String" mode="IN" optional="true"/>
        <attribute name="invoiceTermId" type="String" mode="OUT" optional="false"/>
    </service>
    <service name="createInvoiceForOrder" engine="java"
            location="org.ofbiz.accounting.invoice.InvoiceServices" invoke="createInvoiceForOrder">
        <description>
                Create an invoice from existing order
                orderId = The orderId to associate the invoice with
                billItems = List of ItemIssuance records to use for creating the invoice
        </description>
        <attribute name="orderId" type="String" mode="IN" optional="false"/>
        <attribute name="billItems" type="List" mode="IN" optional="false"/>
        <attribute name="invoiceId" type="String" mode="OUT" optional="true"/>
    </service>
    <service name="createInvoicesFromShipment" engine="java"
            location="org.ofbiz.accounting.invoice.InvoiceServices" invoke="createInvoicesFromShipment">
        <description>
            Create invoice(s) from a Shipment
            invoicesCreated = List of invoiceIds which were created by this service
        </description>
        <attribute name="shipmentId" type="String" mode="IN" optional="false"/>
        <attribute name="invoicesCreated" type="List" mode="OUT" optional="true"/>
    </service>

    <service name="checkInvoicePaymentApplications" engine="java"
            location="org.ofbiz.accounting.invoice.InvoiceServices" invoke="checkInvoicePaymentApplications">
        <description>Checks to see if the payments applied to an invoice total up to the invoice total; if so sets to PAID</description>
        <attribute name="invoiceId" type="String" mode="IN" optional="false"/>
    </service>
</services>
